label,comment
0.0,nam mô anh di đà phật nam mô anh di đà phật nam mô anh di đà phật
0.0,sigmaboy tao xuống đánh nhau với ma luôn
0.0,ủa sao truyện đầu nửa vời vậy
0.0,ngay những ngày cuối năm bế tắc không lối thoát chồng bị người ta hại vướng vào lao lý con bệnh tật vợ thì bị người ta lừa hết sạch đồng tiền cuối cùng phải làm sao đây bắt đầu như thế nào ai có thế giúp tôi chỉ cho tôi biết việc đầu tiên tôi phải làm gì không
0.0,mình tuổi ra trường được nửa năm đi làm được năm nhưng công việc vẫn chưa ổn định không biết bản thân muốn gì thật sự thích cái gì cứ cố loay hoay trong mới bồng bông áp lực vì hoàn cảnh gia đình không được khá giả không có hậu thuẫn tài chính còn có đứa em gái đang học tiểu học vừa chia tay bạn trai năm mình đã cố gắng không để bản thân rảnh quá nhiều bằng cách tập gym chơi cầu lông hoặc bơi mặc dù công việc không mấy khả quan với những đồng lương ít ỏi nhưng mình cố gắng đi làm về xong ăn nhẹ rồi đi tập tự nấu ăn đem theo đi làm cuối tuần sẽ đi bơi hoặc đánh cầu chỉ có chơi thể thao và bận rộn như vậy mới cho mình cảm giác bản thân không vô dụng hy vọng năm sau mình sẽ quay lại với công việc tốt hơn biết được bản thân thích cái gì và mạnh mẽ hơn bây giờ nhé tôi ơi
0.0,điểm nóng thủ tướng phát tín hiệu nóng việt nam nhận vé vàng đặc biệt ông lớn sẵn sàng
0.0,sao không làm thêm xe phòng ăn riêng nối vào
0.0,sao dtw nào cũng có bản gốc kinh dị v
0.0,vui thì vui thật nhưng tui thấy có người đi xe không đội mũ bảo hiểm đã vầy còn chất nữa chứ
0.0,t có trong đó nè
0.0,tốt nhất tránh xa trung quốc càng sớm càng tốt nếu còn chơi với trung quốc luôn luôn phải lo đối phó không có thì chết vì họ rất độc ác
0.0,nghe mà thấm từng câu từng chữ
0.0,anh làm về trường sĩ quan lục quân đi
0.0,toi muốn nghe sự kết hợp giữa datkaa và kicm huhuuhu
0.0,nghe mà tui muốn khóc luôn
0.0,biết viết welcome đúng chính tả dí ác
0.0,câu mong chờ bé màu khỏe mạnh
0.0,mình có đánh ngen là đánh luôn người nha tại người qua lợi mới vậy
0.0,hoang mang
0.0,cấm chỉ khòng cho xi jinping bình đẳng với mỹ xi chỉ đáng làm đầy tớ cho mỹ mốt ten đầy tớ lao động rẻ mạt
0.0,trường học thân thiện ghê
0.0,cứ dịp nào xem hải sapa lại mập thêm mấy chục kg ngày xưa giờ kg rồi
0.0,thươ người thi như người khi tôi không biê t pha i la m ca i gi tôi chơ t nhâ n ra sau nga y lông bông la bơ i tôi không muô n la m gi ca co n go i la lươ i anh thâ t ra nê u muô n tôi co thê liê t kê ra giâ y ca đô người thư trong hiê n ta i tôi co thê la m được nhưng ma kêu bă t tay va o la m đi thi cha n lă m va thê la lươ t facebook ca nga y hê t phim
0.0,lý do khởi tố bắt tạm giam cựu bộ trưởng chủ nhiệm văn phòng chính phủ mai tiến dũng
0.0,phô ngươ i hoa không đô i trơ i chung
0.0,admin ra các bộ kỹ đi admin
0.0,thấy bình thường
0.0,tiền để làm gì chết không mang theo được
0.0,hay mà kinh dị quá
0.0,khách mời mc dễ thương vui nhưng phần hình ảnh đồ ăn hơi ít
0.0,tuyển việt nam chỉ hợp với hlv hàn chứ không hợp pháp kakakak
0.0,mẹ tiêu để một đường nội dung một nẻo
0.0,công nghệ là ứng dụng phát minh
0.0,chắc vì cô vít lên xh nhiều kẻ mắc bệnh chó điên này vây thang này cũng như chó điên rồi
0.0,trung quoc noi lao ban khong nen quang ba cho ho dai nay cua trung quốc khong nen xem
0.0,ông này lấy ảnh đại học hùng vương ở phú thọ nói đh hùng vương tp hồ chí minh
0.0,sao không nói tới mit nhỉ
0.0,chị la lạc điềm
0.0,hâhhahah
0.0,cái này tui được học từ hơn năm trước trong chương trình homeschooling
0.0,cùng việt nam nhưng nghe giọng cách nói người khác vùng miền thì nó hơi khó nghe
0.0,skkddkksldkkdlwkksksksk
0.0,ex hình ảnh về tình hình là mình có đỡ cho
0.0,n de cy rut u ra gi du vi o jd re ngon v tht hat hat
0.0,loan lê
0.0,tui thù vả nó luôn
0.0,lên xem từ miền bắc rồi sang miền nam rồi lại qua miền trung rồi lại nhảy sang miền bắc hóng đầu ví dụ đến cuối ví dụ không thấy trường mình đâu đại học văn hóa hà nội hucccccccccccccc
0.0,nếu không phải bẩm sinh thì bệnh động kinh có thuốc đặc trị được nha bạn ơi
0.0,thẳng tiến rồi cảm ơn những yêu thương đã dành cho datkaa lên nào lên nào
0.0,thế vì sao yêu đơn phương lại khóc vậy
0.0,mình chọn tụ
0.0,mona lisa hút thuốc
0.0,lúc quen nhau diễn nhiều quá nên lấy nhau mới hiện nguyên hình thôi
0.0,chắc cô vợ tiết kiệm ít dám mua cá lóc cho chồng ăn nên ảnh phải ra ngoài tìm miếng ăn ngon ngon tí
0.0,tử hình luôn không chấp nhận được loại khỏi già khỏi xác hội vĩnh viễn không cải tà quy chính đuocj
0.0,triều tiên không sợ thằng nào trên thế giới
0.0,real đóng cửa đốt nhà
0.0,tui tưởng bánh flan làm bằng đường thăng hơi vừa rồi đổ lên chứ chưa thấy đổ cafe
0.0,hết xừ khuyến mãi fpt rồi
0.0,làm đơn giản hoá đọc thân đi anh
0.0,đừng vào huce
0.0,quá tội nghiệp cho nhân dân triều tiên
0.0,vô minh
0.0,zợ quá
0.0,zelensky lẻo mép thật
0.0,không cứu nổi làm bài đ mà tính bài thi ra đ
0.0,bạn làm video từ các nước khác đi
0.0,trường toi
0.0,gặp t là con tiểu vy t chặt xác hết bọn bắt nạt rồi
0.0,xin trân trọng cảm ơn bài viết của chương trình mình cảm ơn bạn đọc và chia sẻ thật dịu dàng ấm áp và thân thiện
0.0,là lên điểm đó má
0.0,hàng trăm cảnh sát tỉnh thành khóa chặt biên giới bắt gọn băng cướp triệu đô
0.0,cảm ơn nước pháp dọc ngang khắp đất mước tôi nhận thấy nhiều nơi những gì pháp để lại nói chung là tuyệt vời tuyệt vời nhà hát lớn tuyệt vời các vi la nay trở thành khuôn mẫu cho người việt xây nhà tuyệt vời tuyến đường sắt chạy từ bắc vào nam chạy cả sang trung quốc lên tới tận vân nam tuyệt vời các thành phố tam đảo và sa pa hải phòng và đà lạt vũng tàu và bà nà tuyệt vời các các cầu thép cầu dumer long biên biểu tượng của công nghệ cầu hàm rồng tràng tiền một hệ thống đường bộ còn trên cả tuyệt vời hơn thế không thu phí nay vẫn chưa lỗi thời nước pháp đã khai sáng cho thuộc địa an nam mang văn minh tiến bộ cơ hội và việc làm xin cảm ơn nước pháp mẫu quốc của an nam vì những gì tốt đẹp mà người pháp đã làm nếu cuộc kháng chiến chống pháp gian khổ và trường kỳ làm hàng triệu người chết rốt cục để làm gì tự do và độc lập nhưng vấn đề thế này độc lập của cộng sản thua thuộc địa thằng tây thua đạo đức xã hội tự do và nhân quyền gấp nhiều lần sưu thuế và chiến tranh triền miên các nước thuộc địa khác được độc lập ngon lành mà không ai phải khổ và chết vì chiến tranh nếu không có chống pháp gian khổ và dài lâu sẽ không có chống mỹ và cả chống thằng tàu ta vẫn được độc lập như mã lai in đô hơn thế lại thực sự dân chủ và tự do miễn là ta lúc ấy không theo tàu theo nga lên thiên đường cộng sản mà làm theo cách ta tức chấn hưng dân tộc khai trí và văn minh theo thuyết bất bạo động của cụ phan chu trinh lịch sử không có nếu mọi cái có nguyên do mỗi thời một nhận thức về độc lập tự do trước sai thì giờ sửa không đổ lỗi cho ai phải vượt lên quá khứ để hướng tới tương lai
0.0,bà giáo này chắc còn sót lại từ thời trung cổ
0.0,trường lớp tui nó toàn ra hành lang trượt không à
0.0,năm nay mình tính ra là mình khủng hoảng cuộc đời à
0.0,trump nên điều tra lý do cháy có thể đó là âm mưu
0.0,ồ nga không chế tạo nổi uav trinh sát hay sao mà phải theo giấy phép từ israel vậy các bạn
0.0,toàn người từ top top qua đây
0.0,chú cùi bắp có thể gọi tui là củ chuối
0.0,thầy giáo giám thị cười một cái mà cả lớp hóa phim kinh dị đúng là kỳ thi đầu đời căng như dây đàn
0.0,chào chụy
0.0,chiêu nay ăn lẩu ngừi
0.0,theo mình để kiểm tra kiểu soát các cơ sở trông trẻ hoặc là lực lượng chức năng có những đợt kiểm tra đột xuất thậm trí được quyền truy cập vào camera của các cơ sở trông trẻ để tiện giám sát quản lý
0.0,gấu sợ hãi top dung cúc mãi mãi top
0.0,gấu sợ hãi không tim comment này đãm bảo thành gấu trúc
0.0,hayyyyyyyy quáaaaaaaaaaaaaaaaaaaaaaaaa
0.0,thằng heo kim young
0.0,nghe mãi không chán á anh datka
0.0,tớ xấu xí quá
0.0,nhà trường ngoài việc giảng dạy cũng cần phải có trách nhiệm đảm bảo cơ sở vật chất an toàn cho người học nữa
0.0,vậy lão bạch và béo chọn đúng xe còn tóc vàng cùng tiểu lan đi sai xehoặc là cả chuyến xe đều bước vào quy tắc mới
0.0,cái đoạn tìm cây bút là tui đã suy ra rùi
0.0,thời ma ha ca dip tu hạnh đầu đà hơn năm đến nay xã hội đã phát triển cách tu phải tuân theo pháp luật không chấp phương tiện ngoài thân hoàng sáu tv dốt nát cứ lãi nhãi phạm giới phạm giới
0.0,khởi tố vụ án được rồi đấy vụ việc này nghiêm trọng hơn ngọc trinh điều khiển môtô phân khối lớn không có gplx hạng anh
0.0,tôi chỉ mong cho tổng thống trum sống lâu sống khỏe để lãnh đạo đất nước mỹ vững mạnh để chống lại tụi bành trướng bắc kinh chỉ có ông mới bắt hết những mưu mô xảo quyệt của đcs tung quốc các bạn ạ
0.0,khi mái vòm được khép lại là lúc mà real bật mod lậy kèo nhưng đó chỉ có trong mơ cách biệt bàn là một điều đó không thể hẹn gặp lại real ở mùa sau với hlv mới
0.0,ac btv ttv có facebook không gửi cho tôi tôi gửi cho ac clip cách làm việc của các anh nhé ac nói làm tôi nhớ đến btv vtv đài truyền hình quốc gia lên sóng nói những người gánh hàng rong sài gòn là ký sinh trùng
0.0,anh ơi sau này nếu được anh làm về nội dung kinh dị gay cấn đuy anh
0.0,may mắn nam sinh không bị thương quá nghiêm trọng
0.0,các video của thầy thật sự nói lên vấn đề của rất nhiều người
0.0,công nhận đồ nhôm của mỹ dùng bền thật kk
0.0,may qua người khong sao
0.0,con cứ di khám rồi uống thuốc theo bác s mong gặp thầy gặp thuốc rôi khỏi bệnh
0.0,mình bị và uống thuốc năm này và nhờ mình có việc làm đủ ăn và về quê đi đây đó yêu bản thân và tự nấu ăn mình bỏ thuốc và ăn ngủ bình thường năm mô anh di đà phật
0.0,đất nước dân khổ thì thì đất nước đấy không thể tồn tại mãi được
0.0,djdbdjb
0.0,bả lo kể chuyện cây thì là mà ông kia ăn hết món chả luôn nhìn mắt cười với thấy thương quá
0.0,thời buổi càng hiện đại càng phức tạp nhiều khía cạnh của cuộc sống ngày càng khó làm ăn với những gia đình còn khó khăn nên những bà vợ thường hay thay đổi theo thời đại sẽ có những chuyện nảy sinh nhiều trường hợp ra đường thấy đàn ông lịch lãm lắm tiền nhiều của nên nảy sinh ý định để được đến với người đó nhưng xin nói rằng kẻ có nhiều tiền không biết tiêu gì vậy nên nghĩ chuyện đi tìm thú vui thể xác cho mình khi họ chơi chán thì họ lại đi tìm sự khác lạ mới họ thay tình nhân như thay áo chẳng có thằng cha nào muốn chung thủy với người mà mình đã đầu áp tay gối một thời gian khi chán mọi thứ họ sẽ quay lại với gia đình với tổ ấm của mình hãy nhớ điều đó đừng ngu dốt dại dột rồi nhục cả đời hối hận không kịp
0.0,triệu chứng hồi hộp bủn rủn tay chân khô họng lạnh đổ mồ hôi mất vị giác suy nghĩ tiêu cực tôi đã bị qua nhờ bv tâm thần điều trị mà hôm nay đã hết ai bị giống tôi hãy đến bv tâm thần tp hcm
0.0,cọp thì không bao giờ sinh ra cừu được
0.0,hải em có síp muối chấm chẩm chéo không
0.0,trung quô chị đa ta o ra virus giê t râ t nhiê u ngươ i trên thê giơ i
0.0,làm quy tắc bệnh viện đi bro
0.0,mấy thằng đông âu nầy sợ nga tấn công là đúng rồi vì chơi xấu nên sợ nga trả đủa là đúng thôi như hungari có sợ đâu
0.0,take example in my phone you can tell you
0.0,nam mô đại từ đại bi cứu khổ cứu nạn linh cảm thiên ứng quán thế âm bồ tât
0.0,à thằng chồng mua cá lóc cho tiểu tam ăn haha
0.0,tr oi cái hình đầu tiên ý là chụp ở trg tiểu hc trg cũ mình nè
0.0,chú công an làm việc rất đúng và lời giải thích rất chân tình mọi người nên ủng hộ bạn ca nầy chúng ta tự suy nghĩ đi ca đi bắt một đứa bé về để làm gì có phải tốt hơn cho cuộc đờ của cháu không
0.0,làm ăn với tàu được đồng thì năm sau tàu lấy lại của mình triệu và lấy luôn mạng của mình luôn làm ăn với tàu sau cùng là mất luôn mạng
0.0,tóc để chấm mắt vậy
0.0,bác sâm cũng chết nhưng chắc nhiều năm nữa
0.0,mình xem phát khóc lun
0.0,xem ví dụ ông này cứ như xem cái quảng cáo có thể tua
0.0,bé rắn quá hiền ơ nghịch chứ đâu pk ngịch đâu admin
0.0,co ơ trong chăn mơ i biê t chăn co gi ngươ i ta ngoa i ti nh cu người co ha người nga n ly do co ơ va o trươ người hơ p cu anh ngươ i ta thi mơ i hiê u va thông ca m đươ chị vi vâ y đư người qua nhanh miê người tô ca o ai rô i tương lai co thê se la ba n đâ y
0.0,mọi người chỉ nghĩ real vì tung hô hàng tấn công của họ nhưng thời điểm này nguy hiểm nhất phải là saka nếu mải mê tấn công real sẽ nhận trái đắng từ s
0.0,như người câu no i râ t hay
0.0,phim này anh làm rồi mà
0.0,sa pa tí vi chung tôi thấy mai lúc nào cũng quai cho phiên và mai khỏe mai ăn khỏe chẳng thay mai giúp bà con nghèo được cái gì lan sao dụng làm thế nữa nhé
0.0,công nghệ sinh ra để xoá dlb để có thể chiếu phim trên fpt play nhằm gia tăng lợi nhuận
0.0,bạn nào được thầy cho tên bài hát thì cho mình xin nhé
0.0,thương chú mọi người cứ để các chú làm đúng việc làm đi ạ tôi khóc rồi
0.0,còn nhớ trận ars với mc ở lượt đi epl pháo thủ có người mà mc không thể ghi bàn cho đến phút bù giờ cuối cùng xem pháo thủ phòng ngự mà mc tức điên máu
0.0,cách tạm biệt nỗi lo bớt mong cầu bớt tránh né có kinh nghiệm đối ứng có trí tuệ bạn tự tin hoặc phải có khả năng chịu đựng bạn có khả năng hài lòng với những gì mình đang có
0.0,chúc bạn nhiều sức khỏe
0.0,mình học trường đó luôn
0.0,đá không lại nên chơi bài tâm lý để ars chủ quan đây mà
0.0,quen va i
0.0,cái gì vậy trời đây là không phải biển
0.0,coi anh lâu rồi mà nhìn lại thì thấy chưa đăng kí v
0.0,mày đang yêu đơn phương ai à ừ cảm giác thế nào vậy đau lắm
0.0,chiến tranh giờ quá hiện đại thiết giáp không còn là vua chiến trường nữa
0.0,à đù má
0.0,mình lắp đặt mạng cáp quang fpt toàn quốc nhé
0.0,toác lói nhanh bao giờ thì bỏ kênh đi làm schannel
0.0,con cá lóc vô tội mừ
0.0,bạch nguyệt quang
0.0,bằng tuổi tao mà đã làm lãnh đạo rồi
0.0,em của tui học trường đấy rồi một em bé hơn học ngay mầm non yên hòa
0.0,laugh
0.0,dạ đó là con trăn à nhe nó hiền
0.0,đoạn cuối lão bạch với thag béo mới sống sót nhé
0.0,cá lóc sad tao có làm gì đâu
0.0,hào quang nhân vật chính đã giúp anh gấu thoát khỏi chết qua câu hỏi
0.0,alligator nghe như arigato tức cảm ơn bên nhật
0.0,không hiểu chuyện
0.0,khí bằng bút chì may sau còn đỡ
0.0,sợ m gì nó có đứa mình nhiều đứa lo gì
0.0,lúc lợi dụng chức vụ quyền hạn tham ô tham nhũng hàng nghìn tỷ đồng thì chắc bà ta tha hồ hô mây gọi gió đi lại như một bóng ma coi dân đen như cỏ giác đúng trời cao cũng có mắt khi bị bắt và tòa phán quyết tử hình thì mới biết hối hận nhưng muộn rồi
0.0,thật sự là rất buồn chẳng biết làm sao tương không còn lối thoát con xin địa tạng bồ tát cứu con với con nằm mo anh đi đà phật
0.0,cái hình sau lưng
0.0,như em t mà gặp con rắn là nó hét aaaaaaaaaaaaaaaaaaaaaaaaaaaaaaaaaaaaa cho cả thế giới nghe luôn chứ lạy t không dám sợ vào đuôi nó chứ nói gì mà sờ vào thân rắn sợ thót tim
0.0,trừ những điểm giống nhau ra thì không có gì khác nhau nghe lú thế nhỉ
0.0,cá nhán mình theo dõi ars nam qua chưa thấy thua bàn
0.0,trông thì ngon mà đắt quá lòng dồi không cân đắt hơn thịt ba chỉ
0.0,anh làm đơn giản hóa trẻ con đi
0.0,chị đi đa nh ghen mà chị còn máu hài trong ngươ i nư anh
0.0,mai ốm cả lũ
0.0,may học khối b
0.0,việt nam lúc có cầu thủ được cầm bóng thì mấy thằng không có bóng đứng im như trời tròng không có phối hợp với đồng đội cứ cấm đầu chạy tốc độ với indo thể hình thì nhỏ xíu chạy như đá s
0.0,đại học bách khoa tên hcmut nhưng logo là hust
0.0,mon an phai co thit cho thi moi la đặc sản pp phai co doi cho nua
0.0,hello em hh
0.0,củ thì chồng tiền mang về thôi d ja những lúc quyết định thấy tín hơn hà lan d
0.0,hay v i
0.0,tử hình
0.0,đang thời gian bảo hộ tân thủ
0.0,năm lớp là lớp t y trang
0.0,mình học trường đó nè
0.0,hianh gau
0.0,trưởng của con tên là tiểu học tam bình ạ trường con bị cháy ở ngày hôm nay ạ ngày ạ chúng con đang học thì tự nhiên phòng tin học bị cháy ạ vì dây nguồn bị đứt ngay chỗ tin học và nó cháy loan ra hết nó loan ra phòng ăn và phòng tin học kế bên lúc đó chúng con đang học thì bạn tuấn kiệt nói với con là ngoài cửa sổ có khói lúc đó con nói kệ đi kệ đi sau đó cô chủ nhiệm nói với chúng con với thầy phương là cháy rồi cháy rồi thầy ơi con không hề hoảng loạn con nói với các bạn là mọi người bình tĩnh đi không sao đâu các bạn lấy giấy bịt miệng bịt mũi lại và cúi xuống chạy con đã học bài rút ra là nếu cháy thì cứ bình tĩnh đã không gì phải sợ chúng ta là anh hùng nhí là người cháu dũng cảm dù cặp của con trên đó mà con không lo sợ không nên sợ vì có cứu hộ rồi không sợ nhé con đã lấy cặp được và con vui khi mọi người an toànmà lúc con ra về con nghe bạn nói chú ơi có học sinh bị t ử v o n g rồi chú ơi con lo sợ trong lòng kêu không sao đâu không sao
0.0,tôi cũng vậ
0.0,chắc mấy bà nội trợ ở miền tây quê tui đi đánh ghen đây nhà mua cả biển ướp đá cho tui ăn giờ cho em này ăn cá lóc mới đau chứ ở tp lớn đánh ghen kiểu khác xé banh chành trần trụi mới hả giận
0.0,cam on bai giang cua thay
0.0,thằng cha mc này không những vô duyên mà còn mất day
0.0,mong chủ ví dụ rep ạ
0.0,kênh tao lao
0.0,cho ai quên thì nếu xét về khả năng chơi phòng ngự thì ars mạnh chắc cái châu âu vì pháo hoàn toàn có thể chơi phòng ngự tiêu cực
0.0,rối não vl
0.0,dọn gì thì cũng dọn đầu dọn đuôi thì mãi ngàn năm vẫn còn
0.0,khoong được oi lai lop khong kieu
0.0,ai có thể hơn nhạc bất quần được
0.0,giống anh đen xì xì
0.0,mình trước ngồi lên lan can quay mặt vào xong đổ ngược ra ngoài may là có cái bục nó gần với mặc áo phao nên cắm đầu xuống chỉ hơi đau nhẹ giờ tầng cũng hơi nguy hiểm với học sinh thật
0.0,má đẻ cái đầu ra trước
0.0,cười chết tui
0.0,anh em nào ra đảo chưa vào bờ thì thêm cái chấm cớm phía sau hit club qua đây bơi cho an toàn này
0.0,sao chuyện cứ lòng vòng mẹ không ra gì các con có quyền nói nhé
0.0,giăng cư anh ngu chị mu anh mưa thâ t đa minh ơi xem ghiê n soi ê ch qua
0.0,nhân vật chính nguuuuuuuuuuu lồnnnnn
0.0,phét ít thôi
0.0,chắc bé lấy quá
0.0,ủa gấu ơi sao cái này nó quen thế gấu hình như là nó giống tập nào á
0.0,thấy hài nhất vẫn là công nghệ nhựa tạo ra túi nylon để hạn chế xài túi giấy hạn chế phá cây lấy gỗ để bảo vệ môi trường giờ thì khuyến khích xài túi giấy hạn chế túi nylon để bảo vệ môi trường theo quan điểm tôi thì nó như cải lùi chứ không phải cải tiến
0.0,anh hải ơi em nhớ có video anh làm vịt quay lạng sơn chỉ bảo cũng em tìm không thấy nhỉ anh để tiêu đề là gì ạ em cảm ơn
0.0,sao không có văn lang anh ơi trường bao ngon mọng nước
0.0,bà tui ch t rôi
0.0,bệnh này ra bạch mai là chuẩn chị gái mình điều chị ở bạch mai năm uống thuốc đều là ok
0.0,tiền vàng chất chồng như núi khong không ai dại gì giết tin vịt
0.0,là zoobie đó
0.0,hãy rút quân về nước trả lại hòa bình cho ukraina
0.0,live hay hơn mv nữa ní chắc có tuổi rồi hát hay hơn lúc trẻ
0.0,da mọi người ơi em thắc mắc người nhà của sư minh tuệ ớ đâu hết mà để khưa tóc dài làm loạn vậy
0.0,phim sợ thì sợ thiệt nhưng admin lồng cái nhạc dô nghe ghê vãi
0.0,kền kền trắng tung đòn hoả mù thôi coi chừng đó
0.0,h em ấy lẹ tay đó nha
0.0,phim không sợ cái nhạc mới đáng sợ
0.0,yêu xa mà đối phương không muốn gặp mình thì có vấn đề không ạ
0.0,anh di đà phật
0.0,hải ơi em nói chủ quán đi bao tay vào nhìn thịt thì ngon mà nhìn đôi tay không muốn ăn chút nào
0.0,tôi rất thịch thương hiệu này
0.0,nija rùa và vua khỉ chỉ làm xiếc
0.0,cảm ơn postcard mình tự hỏi vì sao lại không biết vì sao thế nhỉ sớm hơn mình luôn luôn bị mất kiểm soát về mặt cảm xúc lẫn lời nói mình cảm thấy lạc lõng buồn phiền buồn bực có khi là sự vô định hỗn độn lắm nó như một sợi chỉ bị rối rắm lại tới mức càng muốn tháo càng trở nên rối có lúc rồi lại tự khóc mà không biết vì sao hoặc lúc bản thân đúng thì không nói một cách bình thường mình cứ ú ớ hoặc đôi lúc lại la lên với ba mẹ ngày hôm nay của mình tồi tệ lắm cảm ơn postcard cậu có lẽ đã giúp cảm xúc mình ổn hơn
0.0,video như l làm video mà không biết tí thông tin nào toàn lướt lướt
0.0,sao kg cho xem voi
0.0,vợ chồng trường học thân thiện dữ chưa
0.0,sup do
0.0,không có truyện đấy
0.0,nhạc tên gì vậy
0.0,bạn làm quy tắc ở nhà hàng
0.0,âm thanh rất nhỏ so với những kênh khác
0.0,tôi phát hiện quy tắc bộ này giống ý chang các quy tắc của bộ anime tôi vô cũng thích kể cả các quy tắc sai hay đúng lời nói chỉ khác chúc th còn lại ý chang
0.0,tui sợ vãi nè mọi người
0.0,ya ua bánh bông lan là của việt à giờ mới biết
0.0,clementine t nghe thành lé mang thai
0.0,hình nền điện thoại là hình gái
0.0,bày tỏ ra cũng không muốn nhìn mặt họ nữa mà họ cũng ngược lại
0.0,sớm à ơii
0.0,tự hào là người công giáo
0.0,nhớ là chỉ có tầng là tầng giải trí mà đk mọi người
0.0,hải phải đi học tiếng mông mới hảu chớ được chớ
0.0,ez bán hết thằng khỉ kia đi lợi dụng bắt nạt tập thể chớ hay ho gì ngoài kia thiếu gì đội xứng với enzo hơn
