label,comment
1.0,không thể nào tự ngã được có thể là do em đó có ý định tự tử
1.0,tuyệt vời lắm ạ biết ơn thầy đã chia sẻ
1.0,nammô adi đà phật xin cảm ơn trương trình rất hay
1.0,cuối cùng là tào lao và thực tế cảnh sát điều tra của hàn quốc kém không tìm ra được vụ án về việt nam mà học hỏi nhé
1.0,mày đã yêu thầm tao năm rồi đúng không
1.0,bịa ra được hay vậy anh đạt
1.0,ôi lạnh giá
1.0,gấu làm hay quãi lúc nào t cũng xem
1.0,delete email and mobile it s tough so i suppose i m not merry in korean maybe i m saying hello kitty
1.0,đầu nì hi gấu
1.0,lạy chúa
1.0,đi giống tiktok hơn
1.0,giọng đọc ai phải không các bác
1.0,trường mình đang học
1.0,tôi thấy trời mưa rất rất vui
1.0,như là cái lớp bất ổn chân chính
1.0,hay quá cám ơn webngay
1.0,ủng hộ arsenal
1.0,cách chữa trầm cảm ạ
1.0,nhìn thấy anh chị ăn thì em cũng muốn thử
1.0,good hay quá
1.0,hi anh
1.0,chị gái xinh vãi
1.0,đẹp quá chị
1.0,phim hay quá
1.0,cơm tối ngon miệng rồi
1.0,dạ nói chuyện có duyên quá và vui ghê
1.0,thực sự em rất muốn sống cs không tầm thường nhưng thật sự không biết mình phải làm gi
1.0,em mong thế giới có thể đối xử với em nhẹ nhàng một chút vì em không xinh đẹp như người ta cũng không giỏi giang như người ta nhưng em là em mà em muốn được làm chính mình chứ không phải làm bản sao của người ta quá khứ của em tồi tệ lắm tệ đến mức em chẳng muốn quen thêm một ai vì em không muốn phải tổn thương thêm nữa em cũng muốn được yêu thương nhưng nó quá xa làm sao em có thể với lấy được đâyvì quá khứ em rất tệ nên em chẳng muốn nói cho anh biết em đã khóc nhiều như thế nào em chỉ mong anh sẽ là người cho em cảm thấy an toàn hơn khi bên cạnh anh em muốn được yêu em muốn được an ủi có những lúc em sai nhưng anh vẫn là người đứng ra xin lỗi em trước em cũng muốn được yêu mà cảm giác tuyệt vời nhất trên thế giới là gì sự an toàn bất chấp tâm trạng tồi tệ của bạn họ vẫn ở lại ngay cả khi bạn đang có một ngày tồi tệ họ vẫn ở lại và khi bạn không làm chủ được lời nói của mình họ sẽ hiểu và ở lại không có gì tốt hơn khi biết rằng ai đó sẽ ở lại cho dù khó khăn đến đâu
1.0,nói không thể hiện cảm xúc mà thầy cười như được mùa vậy
1.0,lúc đấy mà có đại bàng sa mạt là ngon rồi
1.0,hẳn là máy móc
1.0,nhiều khi cảm xúc tớ có rất nhiều mớ hỗn độn ngày xưa tớnlaf người dễ tính ngăng động và hoạt bát nhưng từ lúc lên lớp cảm xúc tính cách tớ dần thanh đổi tớ dễ nổi dận dễ khóc và hay sợ hãi không muốn tiếp xúc với một ai lúc lên cấp trở lên tớ mới biết mình bị trầm cảm và tớ đã biết đến kênh bạn nó khá ý nghĩa và có ích với tớ bh tớ đỡ hơn xưa rồi chỉ là vẫn còn một chút trẩm cảm
1.0,chậm phút
1.0,impresionante video la idea de cambiar por completo la vida en una semana es inspiradora anh por ello
1.0,quá chuẩn
1.0,cảm ơn video này của thầy
1.0,tài liệu mật mà chú con nghĩ chắc không sao đâu chủ nhật vui vẻ an lành sức khỏe chú nhé happy weekend
1.0,khi nào học bài hay làm btvn mình đều bật podcast của admin lên nghe cảm thấy lòng nhẹ hơn đôi lúc còn cảm nhận được mình trong câu chuyện nào đó và nhận được những lời an ủi lời khuyên nhẹ nhàng và chân thành nhất
1.0,chân thành cảm ơn bạn và ekip
1.0,cầu nguyện cho bé bình phục
1.0,tưởng đâu bài mới ra không à trời
1.0,cảm ơn chị táo rất nhiều chẳng biết là ai
1.0,vô tình gặp video đúng h mà nhà lại hết mì gói nữa thật là thê thảm
1.0,tôi muốn bể bụng
1.0,em cảm ơn anh
1.0,bắt được đối tượng lam gái thi từ nặng vào hoặc tử hình
1.0,cũng vui mà nhỏ còn học sinh thì vui lắm lớn lên thì cực khổ đi làm
1.0,thật tuyệt vời của bà dám đôc hoan hô bà
1.0,phụ nữ bây giờ đi ngoại tình đông như quân nguyên có gì lạ nữa đâu không những ngoai tình thông thường mà còn rất nhiều người tình nữa là đằng khác quen ngoài đời có những người yêu cũ có trên zalo có facebook trang mục hò hẹn có v v còn trên thực tế sát nữa thì hỏi mấy người làm trong khách sạn họ chứng kiến mỗi nắm tới hàng trăm phụ nữ ngoại tình điểm thứ là đàn ông vô đó với phụ nữ là để ngoại tình với phụ nữ ngoại tình vầ nó cũng đi hết bạn này đến bạn khác thì những bạn đó là những bạn ngoại tình đó thôi tóm lại là nó đông như quân nguyên
1.0,chị vy làm em vui hơn nè
1.0,con cảm ơn thầy con ngộ ra quá nhiều từ bài của thầy mong có duyên với lớp thiền của thầy ạ
1.0,đây chắc chắn là ước mơ ủa mọi lứa tuổi hs nhưng mà nhìn nó lạ lắm
1.0,hi nhô à gấu
1.0,chúng nó hét vì vui đấy
1.0,tôi mà là tiểu vy chắc vui cả đời mất mình được ma quỷ bảo vệ mà không có ác ý mà
1.0,xin lỗi đã nhìn vào hình ạ
1.0,ở hoàn cảnh nào cũng luôn có tình yêu thương và luôn giữ tâm thanh thản thì năng lượng nó ngày càng nhiều không những mình vui vẻ mà năng lượng tích cực nó còn tạo ảnh hưởng tốt đến những người xung quanh
1.0,ngu qua sao moi viecfui duyen
1.0,video quá bổ ích luôn chị ơi giờ em mới xem được
1.0,ung ho tt trump forever
1.0,thật là đau lòng mà lòng người càng ngày càng ác chi vi hai chứ danh lợi
1.0,toi bị nam đỡ roi van còn toi song lành mạnh không khỏi đuoc vì toi phải gánh vác đàn con bị người thân làm phiền toi không đuoc an yen nên benh kéo dài
1.0,khánh dễ thương
1.0,hữu duyên xem được video này và biết ơn bạn
1.0,tuyệt vời lắm anh hải sapa
1.0,từ khi coi câu chuyện bé huyền mình thích xem kênh anh em chia sẽ mong anh em cố gắng đừng bỏ cuộc tội gd em huyền
1.0,hảo hán
1.0,bởi mới nói từ bi phải đi kèm trí tuệ anh công an này đang cố gắng giải thích trong sự bất lực trước lòng tốt không đúng chỗ của mọi người
1.0,em cám ơn chị đã đem lại những năng lượng tích cực mỗi khi stress em đều coi lại chiếc vlog này nó làm em cảm thấy yêu đời và biết ơn những điều nhỏ nhặt làm mình hạnh phúc
1.0,phụ nữ vietnam bây giờ học quyền cước vịnh xuân quyền song phi đá tyên thụi dưới vỡ hết cả ấm chén của các anh dạo phố
1.0,nghe chuyện t thấy câu chuyện của chính mình người chx từng nghĩ đến vợ chồng mình sẽ thích ai nma rồi lại thích anh được năm cũng đã nói thích cậu vào ngày và cũng bảo cậu mình đã tubo rồi nma có lẽ tcam ấy đặc biệt đến mức mà khi em đã nói tubo anh rồi mà đến bh vx thích thích đến mức mù quáng cái mức đau lòng
1.0,em chào anh em mới theo dòi kênh của anh hy vọng anh có thể làm thêm nhiêu video reup hơn nữa ạ
1.0,video rat hai hài dón
1.0,đột quỵ rồi
1.0,chung quy lại sau khi trải qua nhìn nhận quan sát những chuyện tình yêu trong cuộc sống này thì cốt lõi duy nhất để mối quan hệ trở nên hạnh phúc mối quan hệ cho đi mà vẫn bình yên đó chính là tin tưởng tin tưởng sẽ có trân trọng trân trọng sẽ có cảm thông cho nhau
1.0,yeww công chúa của em lắm luôn
1.0,em không muốn sống nữa cuộc sống như ác với em em bị cô lập bị đánh trong lớp em chỉ ngồi mình không có tiếng nói thật sự giờ em chỉ có gia đình nhưng em nhát em không dám nói trong đầu em luôn có suy nghĩ em se tu tu bất cứ lúc nào bây giờ em phải làm sao đây
1.0,nam mô anh di đà phật con cảm ơn thầy nhiều lắm chúc thầy nhiều sức khỏe
1.0,em từng xem video này của anh hồi em còn đi học lúc đó em chỉ xem chứ không cảm nhận được gì giờ thì em đang trải qua nó rồi em khóc nhiều em tìm đến tâm linh để thấy an ủi cảm ơn anh giờ em sẽ bình tĩnh hơn để soi xét lại mọi thứ
1.0,tin vui tin vui
1.0,co le mo n ca loc la mon khoái khẩu ong chong
1.0,anh công an mới đúng là tấm gương rất tốt mong rằng các anh nên dẹp bỏ hết nạn ăn xin ngoài đường phố những người ăn xin tôi rất mong cơ quan nhà nước việt nam nên có công ăn chỗ ở cho những người cơ nhỡ mở lớp học cho các em nhỏ cần trừng trị thích đáng những kẻ chăn dắt những đứa trẻ như bắt đi bán vé số thổi lửa cần trừng trị mạnh tay những kẻ mất tính người đó hành động việc làm của anh công an tôi rất ngưỡng mộ và tôn kính anh
1.0,mình cũng có ông nội mà ông nội mình mất rồi mình cũng giống như chị này luôn nè lúc mình chưa được sinh ra là ông nội mình mất rồi là mình buồn lắm luôn
1.0,video lat di lat lai
1.0,một đời an nhiên youtube rất hay tham khảo phật dạy trí tuệ
1.0,là sao rốt cuộc chỉ học được là muốn hạnh phúc mà nghe chứ hạnh phúc là xồn lên
1.0,lần đầu tiên nghe hết bài chia sẽ khá dài của anh cảm ơn anh vì đã chia sẽ những trải nghiệm và bài học hi vọng sắp tới sẽ đi qua giai đoạn khủng hoảng nàyyyy
1.0,những câu nói là kết tinh của sự trải nghiệm mang tính động viên và truyền nghị lực thanks tác giả và nhóm
1.0,mình rát thích giong noi của anh đình van
1.0,hai em nhé tin cho chị được không
1.0,ông tuệ là người ăn nói lương lẹo
1.0,người việt mình thật tuyệt vời
1.0,ok chương trình rất hay người nói có giống nói qua hay và làm cho người nghe nhiều xúc dong
1.0,chúc em mau lành
1.0,ảo thật đấy
1.0,bác sĩ nói hay quá em học tâm lý học cho dù biết đa số những điều bác sĩ nói nhưng vẫn muốn nghe tiếp
1.0,ớ em dậy mở điện thoại vid này của chị xem nè
1.0,dạo này em hay sờ trét lắm nuôn kiểu covid cái ở nhà á hơi bored mà xem vlog này chị mấy lần thấy đỡ ghê
1.0,quá tuyệt vời mình đã làm theo tầm ngày thì đã có hiệu quả hẳn thật cảm ơn anh đã cho mọi người những bài học quý giá
1.0,cám ơn vy chúc vy luôn mạnh khỏe và xinh đẹp
1.0,anh ơi em mới mà đã thấy dính rồi
1.0,hiểu rồi người anh em anh giữa chết anh cạnh số là cười người anh cạnh anh giữa thấy không vui liền giết anh số và số là số xe bus sống sót
1.0,hay de thuong cam on admin
1.0,cuộc sống rất vi diệu
1.0,trong tiếng anh tình love yêu loveta có tình yêu tình yêu love love love love love love love love love ta chia làm hai trường hợplove o là tình bạn hoặc love là tình yêu đến phíaphương trình tình yêu không nhận nghiệm love chứng tỏ tình yêu đơn phương là vô ích
1.0,bé đó có thể nhìn lộn hoặc chưa bt dấu bé tưởng đó có thể là dấu nên tưởng nên mới nói là điểm
1.0,rất cảm ơn thầy
1.0,ai củng vậy sóng trên đời nầy không toàn vẹn hết đâu củng phải có nỗi khổ của riêng mình mà phải cố gắn vượt qua chính mình ai muốn đi thì cứ đi có nếu kéo củng chẵn được gì hảy lo cho chính mình là tốt hơn để vượt qua dông bảo của cuộc đời mới có ngày hạnh phúc
1.0,cuộc đời chưa khi nao la ổn hết chuyện này tới chuyện khác quá khổ tâm
1.0,nha ong thi không thay an toan di an o quan người ta quan ong chac không ngon dau nhi à
1.0,trách nhiệm thuộc về nhiều người lắm
1.0,em rất thích ví dụ về việc khao khát hạnh phúc nhưng lại hành động bài trừ hạnh phúc cám ơn anh rất nhiều
1.0,ủa đồng phục thể dục trường t mà
1.0,mun ơiđời còn dài trai còn nhiều đừng buồnchị mình đã tự tử vì không được yêumình đã từng muốn chết
1.0,ca m ơn ba n
1.0,ôi troi khổ quá nhỉ
1.0,tuyệt vời
1.0,theo tình hình phim thì có lẻ những ma quỷ coi tiểu vy như người con em cháu họ cũng muốn bảo vệ cô
1.0,em cảm động quá
1.0,ngay lúc này là lúc em mất phương hướng vô định em nghe được bài này cảm ơn thầy em sốc lại tinh thần đây em mong em sẽ có thể trở lại với phiên bản tuyệt vời cảm ơn thầy
1.0,xin trân thành chìa buôn cùng gia đình ạ
1.0,ôi trời thầy cô không hiểu gì
1.0,đúng đó bà con nên để ca làm việt với các cháu vì có dấu hiệu sai sai nên ca mới vào cuộc nên mừng cho các cháu đã được quan tâm
1.0,tự nhiện vui lên một cách nhiệm màu
1.0,cảm ơn thầy đã chia sẻ kiến thức hay
1.0,phim hack não ảo vãi chưởng khúc cuối tác giả quay xe giả định vãi thật
1.0,ai bên phe của đồng chí công an đâu thương lắm
1.0,tui ghét mấy cái trend ồn này lắm mà giờ thấy câu chuyện kinh dị này xong tui mừng phát khiếp
1.0,muộn s
1.0,thanks thầy và tinh tân
1.0,amerika oder brasilien
1.0,vô tình hành vi của bé gái chính là hành vi thôi miên loài rắn
1.0,tr oi cuối buồn v gấu
1.0,nếu bạn đọc được comment này thì bố mẹ bạn sẽ không bị sao cả gia đình bạn sẽ gặp nhiều may mắn gia đình mạnh khỏe hạnh phúc hãy lan tỏa điều này đến video tiếp theo đến cho những người khác thì may mắn sẽ thành hiện thực và giải bỏ những comment của những đứa trù ki
1.0,ăn nhiều puá phải bé bụng thoi
1.0,chỉ cần viên kẹo là dântt bớt khổ
1.0,to an noises can noi said su that
1.0,mấy nhóc kiểu vui quá được nghĩ rồi
1.0,tiểu vy sướng thế mà cứ sợ hoàiii hơi ghen tị aa
1.0,thấy lúc bạn học bị chet ở sương mù tự nhiên thấy tội
1.0,chắc là bị người âm làm rồi
1.0,nóng hổi ngon quá
1.0,lòng tiếng
1.0,mạn phép hỏi thầy thầy có theo thiền lý hồng chí không ạ
1.0,cảm ơn những chia sẻ của anh thật sự có thể thay đổi được một cuộc đời biết ơn anh
1.0,thằng này khá
1.0,đắm chìm hoàn toàn vào việc cần thiết hiện tại cảm ơn kiến thức giá trị bạn chia sẻ
1.0,hello em chào chị châu mòe
1.0,dù là ai hại tuấn lâu đài phải bị đau đớn chết thê thảm và bị tù đày đoi khổ bởi sự thật luật pháp công lý và pháp luật tổng luật đảng chính trị tổng sắc lệnh chiến công tổng luật lệnh luật
1.0,tạ ơn chúa và mẹ maria
1.0,nghe phân tích thì hình như người yêu của bả mới là người viết bài mà nhỉ vì trong lời bị lượt bỏ thì người cha vì quá đau buồn nên đã mất theo con gái
1.0,đúng clip mình đang cần
1.0,love dạ
1.0,làm theo này tuần coi được không không games không shot không youtube
1.0,tuyêt vời khi nghe các chuyên gia chía xẻ
1.0,vừa trùng hợp hôm nay là con thấy mình thật hữu duyên khi gặp video này
1.0,em chào anh nguyễn hữu trí em là người xem anh từ những ngày đâu làm video thời điểm đó anh còn hay bận vest rồi trang điểm thì phải ạ em chắc chắn bài giảng này của anh em đã xem từ năm trở lại đây và chắc sắp đạt lần thứ nhưng em cứ quên mãi và lạc lối trong chính con đường mình đang đi khi có quá nhiều tham vọng và sức người hạn cũng như ôm đồm quá nhiều thứ dần dần em không chỉ cân nhắc tiền là yếu tố duy nhất trong cuộc sống của bản thân hay tình yêu nữa cũng nhờ những bài giảng của anh chắc chắn không phải là câu trả lời hoàn hảo cho mọi người nhưng nó giúp cho em định hướng lại mọi thứ trong cs qua các video của anh đặc biệt là video này em chắc chắn bản thân chưa thực sự giỏi nhưng nhờ anh trao giá trị mà em cũng đã hỗ trợ định hướng được rất nhiều bạn trả thực tập ở công ty em hay em đã từng gặp một lần nữa vô cùng cảm ơn mr queo
1.0,thích một người mà mình không biết gì về họ ngay cả họ tenn
1.0,em cảm ơn thầy
1.0,video mất bao lâu ạ
1.0,em tuổi đã tốt nghiệp em hiện tại được nhận vào công ty nước ngoài em được nhận vào là do có người quen xin cho vào và làm một mảng không phải chuyên môn hoặc có thể nói em chả biết gì về nó ngoài mấy cái lý thuyết xáo rỗng khi trải qua các vòng phỏng vấn thì em biết bản thân không phù hợp với công ty họ yêu cầu đối với nhân viên quá cao trong khi em thì quá thấp nhưng do có người quen giúp đỡ nên em vẫn có thể vào được công ty đó với trình độ như em thì cần bắt đầu ở mức học việc nhưng công ty không có chế độ học việc mà là thử việc em áp lực với việc bản thân không có kiến thức mà phải tham gia vào dự án việc vừa học vừa làm sẽ làm em chậm đi trong việc hoàn thành các task có khi sẽ ảnh hưởng đến cả tiến độ dự án nếu làm chậm vậy em sẽ đánh giá tệ trong thời gian thử việc và việc chậm chạp đó kéo theo việc phải ot và ngoài trên công việc trên công ty thì về nhà em còn phải liên tục bổ sung vào các vấn đề thiếu sót của em trong quá trình đi học mọi người đừng chê em là đi học không học kiến thức thầy cô dạy là kiểu nói sao làm thế đi chứ không phải sự cốt lõi để hiểu vấn đề mà muốn duy trì sức khỏe để có thể đầy năng lượng cho ngày hôm sau em không thể ngủ quá ít tiếng ngày được thế là em ngoài tiếng làm việc về bổ sung các kiến thức cũ học tiếng anh thì đổi lại em có tinh thần chán nản phiền muộn ngay lúc comment này là tinh thần em đã suy sụp vì việc đọc không hiểu được công việc mong các bạn còn ngồi trên ghế nhà trường mà đọc được comment này của mình thì các bạn hãy học hành chăm chỉ tập trung vào nền tảng vì nó là cốt lõi để phát triển những cái khác đừng như mình học bề mặt mà thôi học tiếng anh thật tốt để các bạn sau này không phải như mình
1.0,vid hay cá chị yêu ơi xem xong em cảm thấy tinh thần happy lên nhiều lắm lun á em cảm ơn vy đã lun là nguồn động lực to lớn để em có thêm nguồn nặng lượng học tập và suy nghĩ lạc quan hơn trong cuộc sống chúc chị yêu của em lun mạnh khỏe bình an lạc quan và suôn sẻ trong cuộc sống cũng như trong sự nghiệp của mình nha yêu chị hẹn ngày sớm nhất được gặp vy nha
1.0,em hy vọng kiếp sau chi sống tốt kiếp này lở lần chức chị kiếp tốt hơn
1.0,quá tran
1.0,giá trị quá bạn ơi
1.0,nhưng chú chưa đổi đời được sau năm nay phải không chỉ có chủ kênh đổi đời thôi
1.0,bị ghiền phim niii quá gấu ơi
1.0,coi đi coi lại không chán để ý nụ cười của ông chú tốt bụng thật tà răm
1.0,nhiều cái thực tế trần trụi luôn nhưng qua giọng kể của thầy em thấy nó nhẹ nhàng hẳn tình yêu hay tình đòi
1.0,t yêu cậu ấy cậu ấy yêu b thân t và b thân t cũng v
1.0,mình cũng đang thích bạn khi mới được đổi chỗ ngồi cùng bạn ấy trẻ con lắm nhưng cậu sống rất tình cảm cậu ấy đã làm mình rung động nhưng cậu ấy đã có người mà cậu ấy thích lúc đó mình buồn lắm chứ nhưng mình không là gì của cậu ấy cả đơn phương khổ lắm mong các cô gái có thể mạnh mẽ nói ra tình cảm của mình với người ấy mình tin các cậu sẽ làm được
1.0,hôm nay có đam lun
1.0,cái này còn hơn chữa lành
1.0,chắc bé nó tưởng là
1.0,tao thách mày tìm nhà của tao mày tìm được tao từ tử
1.0,tksss chị vy rất nh em yêu chị
1.0,xưng anh kêu chị nghe dễ thương ghê
1.0,thích cái nét này ghê
1.0,xem video của chị vy mà em hạnh phúc vô cùng từ sâu thẳm trong trái tim em thực sự biết ơn chị vy của em rất rất nhiều thực sự rất tuyệt chị ạ em thấy em có nhiều điểm tương đồng giữa em và chị về tính cách và suy nghĩ xem những video của chị mà đã giúp cho em tìm thấy giải pháp cho mình giúp cho cuôcj sống của em rất nhiều chị là hình mẫu để em phấn đấu hàng ngày đó ạ yêu chị vô cùng thank you thank you i love you
1.0,ngày nhà em thì cực mà em cảm thấy mình chưa cố gắng nhiều em đi làm đã được nhiều năm nhưng vẫn không tích góp được gì cho bản thân em ít chia sẻ với mọi người trong nhà hy vọng mọi điều sẽ thay đổi và em sẽ đạt được những điều mong muốn vào những năm tiếp theo và em sẽ quay lại khi đã hoàn thành mọi thứ
1.0,mình cũng bị trầm cảm một ngày chỉ ngủ được đến tieng vo cùng mệt mỏi chán nản nhưng nhờ tập pháp luân công bây h một ngày mình có thể ngủ được tiếng ăn uống ngon miệng suy nghĩ tích cực
1.0,chào admin đợi nãy giờ
1.0,hello em chào chị mc châu moè
1.0,ông bị vợ cắm sừng thì ông ly hôn còn ông tha thứ
1.0,những câu nói hay và ý nghĩa quá ạ cảm ơn những điều tích cực mà video đã mang lại cho cuộc sống
1.0,fun fact đang thi thì lớp khác cháy cả lớp được điểm khỏi thi
1.0,chào gấu nha
1.0,công an việt nam là phải thế
1.0,cái gì nghe o hiểu qua sàn lọc của baba đều phải biến thành dễ hiểu chịu o nổi khoái baba lắm lắm lun á
1.0,fucking campuchia
1.0,yêu anh gấu nhìu lắm ó
1.0,thương cháu là cứu cháu cảm ơn chú công an
1.0,nên cho thằng ăn cháo đá bát này muốn đi đâu thì đi đúng là tụi vô ơn với bất cứ ai
1.0,hàng giả được lưu hành trên thị trường thì cũng phải xem xét thêm cơ quan chức năng cấp phép cho cơ sở hoạt động hoạt động rầm rộ như công ty này mấy năm cũng do quản lý lỏng lẻo
1.0,thanks for your sharing i m so grateful and happy after watching your video i believe that your positive attitude to life will be contagious to everyone
1.0,cac nha hao tam dong gop tien de giup do nha co hoan canh kho khan neo don cung de nuoi vo chong anh phao an sung mac suong thoi
1.0,cảm ơn sự chia sẻ tận tâm
1.0,mỗi lần xem vid của vui vẻ thì lun cuốn
1.0,thằng em tao là boss
1.0,vợ chồng em thật tuyệt vời
1.0,giá mà tôi nghe được podcast này sớm hơn
1.0,ước gì mình nghe sớm hơn chúc bạn mãi bình an và mạnh khỏe cảm ơn rất nhiều
1.0,bọn này nó lừa biết bao nhiêu người nhà tan của lát thập chi còn cũng theo vào tù luôn
1.0,bao tử của bạn chính là hạnh phúc sức khỏe của bạn đấy nhé có ăn uống đầy đủ mới vực được đạo sức khỏe là tài sản lớn nhất của loài người chúng sanh yêu thương yêu thương yêu thương
1.0,nhà cửa đường xá quy hoạch đẹp quá đúng là đất nước của những giấc mơ
1.0,lúc nào cũng có vui là bé huyền tỉnh táo hẳn ra
1.0,pov tôi được quái vật bảo vệ
1.0,mình luôn nghĩ tới tự tử như nghĩ tới con luôn bỏ qua cái tự tử lieu có phải mình bị trầm cảm rồi hay không nhỉ
1.0,vừa ăn vừa xem nó tuyệt gì đâu
1.0,cảm ơn triec lý cuộc song
1.0,cảm ơn bạn đã chia sẻ video này rất nhiều thông tin hay ho và hữu ích bạn có thử cách này chưa hãy chia sẻ cảm nhận và ý kiến cá nhân của bạn dưới bình luận
1.0,mày đã yêu thầm tao năm đúng không đúng rồi thật là gay cấn
1.0,ở nước ngoài có những vụ án giống như không có chính quyền hay pháp luật thật trớ trêu ở việt nam thật tuyệt dân kêu la vụ án được làm rõ
1.0,chúc em mạnh khỏe ạ
1.0,mình ở thanh bình nè
1.0,thanks you
